<?xml version="1.0" encoding="UTF-8"?>
<testCases xmlns="http://www.omg.org/spec/DMN/20160719/testcase" xmlns:xsi="http://www.w3.org/2001/XMLSchema-instance" xsi:schemaLocation="http://www.omg.org/spec/DMN/20160719/testcase ../testCases.xsd">
	<modelName>0009-append-flatten.dmn</modelName>
    <labels>
        <label>Compliance Level 3</label>
        <label>Literal Expression</label>
        <label>Item Definition</label>
        <label>FEEL List</label>
        <label>FEEL Functions: lists</label>
    </labels>
    <testCase id="001">
		<inputNode name="simpleList">
			<list>
				<item>
					<value>a</value>
				</item>
				<item>
					<value>b</value>
				</item>
				<item>
					<value>c</value>
				</item>
			</list>
		</inputNode>
		<inputNode name="nestedList">
			<list>
				<item>
					<list>
						<item>
							<value>w</value>
						</item>
						<item>
							<value>x</value>
						</item>
					</list>
				</item>
				<item>
					<value>y</value>
				</item>
				<item>
					<value>z</value>
				</item>
			</list>
		</inputNode>
		<resultNode name="literalSimpleList" type="decision">
			<expected>
				<list>
					<item>
						<value>a</value>
					</item>
					<item>
						<value>b</value>
					</item>
					<item>
						<value>c</value>
					</item>
				</list>
			</expected>
		</resultNode>
		<resultNode name="literalNestedList" type="decision">
			<expected>
				<list>
					<item>
						<list>
							<item>
								<value>w</value>
							</item>
							<item>
								<value>x</value>
							</item>
						</list>
					</item>
					<item>
						<value>y</value>
					</item>
					<item>
						<value>z</value>
					</item>
				</list>
			</expected>
		</resultNode>
		<resultNode name="append1" type="decision">
			<expected>
				<list>
					<item>
						<value>a</value>
					</item>
					<item>
						<value>b</value>
					</item>
					<item>
						<value>c</value>
					</item>
					<item>
						<list>
							<item>
								<value>a</value>
							</item>
							<item>
								<value>b</value>
							</item>
							<item>
								<value>c</value>
							</item>
						</list>
					</item>
				</list>
			</expected>
		</resultNode>
		<resultNode name="append2" type="decision">
			<expected>
				<list>
					<item>
						<value>a</value>
					</item>
					<item>
						<value>b</value>
					</item>
					<item>
						<value>c</value>
					</item>
					<item>
						<list>
							<item>
								<list>
									<item>
										<value>w</value>
									</item>
									<item>
										<value>x</value>
									</item>
								</list>
							</item>
							<item>
								<value>y</value>
							</item>
							<item>
								<value>z</value>
							</item>
						</list>
					</item>
				</list>
			</expected>
		</resultNode>
		<resultNode name="append3" type="decision">
			<expected>
				<list>
					<item>
						<value>a</value>
					</item>
					<item>
						<value>b</value>
					</item>
					<item>
						<value>c</value>
					</item>
					<item>
						<list>
							<item>
								<list>
									<item>
										<value>w</value>
									</item>
									<item>
										<value>x</value>
									</item>
								</list>
							</item>
							<item>
								<value>y</value>
							</item>
							<item>
								<value>z</value>
							</item>
						</list>
					</item>
				</list>
			</expected>
		</resultNode>
		<resultNode name="append4" type="decision">
			<expected>
				<list>
					<item>
						<value>a</value>
					</item>
					<item>
						<value>b</value>
					</item>
					<item>
						<value>c</value>
					</item>
					<item>
						<list>
							<item>
								<list>
									<item>
										<value>w</value>
									</item>
									<item>
										<value>x</value>
									</item>
								</list>
							</item>
							<item>
								<value>y</value>
							</item>
							<item>
								<value>z</value>
							</item>
						</list>
					</item>
				</list>
			</expected>
		</resultNode>
		<resultNode name="flatten1" type="decision">
			<expected>
				<list>
					<item>
						<value>a</value>
					</item>
					<item>
						<value>b</value>
					</item>
					<item>
						<value>c</value>
					</item>
					<item>
						<value>a</value>
					</item>
					<item>
						<value>b</value>
					</item>
					<item>
						<value>c</value>
					</item>
				</list>
			</expected>
		</resultNode>
		<resultNode name="flatten2" type="decision">
			<expected>
				<list>
					<item>
						<value>a</value>
					</item>
					<item>
						<value>b</value>
					</item>
					<item>
						<value>c</value>
					</item>
					<item>
						<value>w</value>
					</item>
					<item>
						<value>x</value>
					</item>
					<item>
						<value>y</value>
					</item>
					<item>
						<value>z</value>
					</item>
				</list>
			</expected>
		</resultNode>
		<resultNode name="flatten3" type="decision">
			<expected>
				<list>
					<item>
						<value>a</value>
					</item>
					<item>
						<value>b</value>
					</item>
					<item>
						<value>c</value>
					</item>
					<item>
						<value>w</value>
					</item>
					<item>
						<value>x</value>
					</item>
					<item>
						<value>y</value>
					</item>
					<item>
						<value>z</value>
					</item>
				</list>
			</expected>
		</resultNode>
		<resultNode name="flatten4" type="decision">
			<expected>
				<list>
					<item>
						<value>a</value>
					</item>
					<item>
						<value>b</value>
					</item>
					<item>
						<value>c</value>
					</item>
					<item>
						<value>w</value>
					</item>
					<item>
						<value>x</value>
					</item>
					<item>
						<value>y</value>
					</item>
					<item>
						<value>z</value>
					</item>
				</list>
			</expected>
		</resultNode>
	</testCase>
</testCases>
