<?xml version="1.0" encoding="UTF-8"?>
<?xml-stylesheet type="text/xsl" href="dmnexecute61220.xslt"?>
<testCases xmlns="http://www.omg.org/spec/DMN/20160719/testcase" xmlns:xsi="http://www.w3.org/2001/XMLSchema-instance" xsi:schemaLocation="http://www.omg.org/spec/DMN/20160719/testcase ../testCases.xsd">
	<modelName>0006-join.dmn</modelName>
    <labels>
        <label>Compliance Level 3</label>
        <label>Literal Expression</label>
        <label>Item Definition</label>
        <label>FEEL Filter (10.3.2.5)</label>
        <label>FEEL List</label>
        <label>FEEL Relation</label>
    </labels>
    <testCase id="001">
		<inputNode name="EmployeeTable">
			<list>
				<item>
					<component name="id">
						<value>7792</value>
					</component>
					<component name="deptNum">
						<value>10</value>
					</component>
					<component name="name">
						<value>Clark</value>
					</component>
				</item>
				<item>
					<component name="id">
						<value>7934</value>
					</component>
					<component name="deptNum">
						<value>10</value>
					</component>
					<component name="name">
						<value>Miller</value>
					</component>
				</item>
				<item>
					<component name="id">
						<value>7976</value>
					</component>
					<component name="deptNum">
						<value>20</value>
					</component>
					<component name="name">
						<value>Adams</value>
					</component>
				</item>
				<item>
					<component name="id">
						<value>7902</value>
					</component>
					<component name="deptNum">
						<value>20</value>
					</component>
					<component name="name">
						<value>Ford</value>
					</component>
				</item>
				<item>
					<component name="id">
						<value>7900</value>
					</component>
					<component name="deptNum">
						<value>30</value>
					</component>
					<component name="name">
						<value>James</value>
					</component>
				</item>
			</list>
		</inputNode>
		<inputNode name="DeptTable">
			<list>
				<item>
					<component name="number">
						<value>10</value>
					</component>
					<component name="name">
						<value>Sales</value>
					</component>
					<component name="manager">
						<value>Smith</value>
					</component>
				</item>
				<item>
					<component name="number">
						<value>20</value>
					</component>
					<component name="name">
						<value>Finance</value>
					</component>
					<component name="manager">
						<value>Jones</value>
					</component>
				</item>
				<item>
					<component name="number">
						<value>30</value>
					</component>
					<component name="name">
						<value>Engineering</value>
					</component>
					<component name="manager">
						<value>King</value>
					</component>
				</item>
			</list>
		</inputNode>
		<inputNode name="LastName">
			<value>Clark</value>
		</inputNode>
		<resultNode name="Join" type="decision">
			<expected>
				<value>Smith</value>
			</expected>
		</resultNode>
	</testCase>
</testCases>
