<?xml version="1.0" encoding="UTF-8"?>
<testCases xmlns="http://www.omg.org/spec/DMN/20160719/testcase" xmlns:xsi="http://www.w3.org/2001/XMLSchema-instance" xsi:schemaLocation="http://www.omg.org/spec/DMN/20160719/testcase ../../testCases.xsd" xmlns:xsd="http://www.w3.org/2001/XMLSchema">
	<modelName>0002-string-functions.dmn</modelName>
    <labels>
        <label>Compliance Level 3</label>
        <label>Literal Expression</label>
        <label>Context</label>
        <label>Item Definition</label>
        <label>FEEL Functions: strings</label>
    </labels>
    <testCase id="001">
		<inputNode name="A">
			<value>banana</value>
		</inputNode>
		<inputNode name="B">
			<value>a</value>
		</inputNode>
		<inputNode name="NumC">
			<value>2</value>
		</inputNode>
		<resultNode name="Basic" type="decision">
			<expected>
				<component name="startsWithX">
					<value>false</value>
				</component>
				<component name="startsWithB">
					<value>false</value>
				</component>
				<component name="endsWithX">
					<value>false</value>
				</component>
				<component name="endsWithB">
					<value>true</value>
				</component>
				<component name="containsX">
					<value>false</value>
				</component>
				<component name="containsB">
					<value>true</value>
				</component>
				<component name="substringC1">
					<value>a</value>
				</component>
				<component name="stringlength">
					<value>6</value>
				</component>
				<component name="uppercase">
					<value>BANANA</value>
				</component>
				<component name="lowercase">
					<value>a</value>
				</component>
				<component name="substringBeforeB">
					<value>b</value>
				</component>
				<component name="substringAfterB">
					<value>nana</value>
				</component>
			</expected>
		</resultNode>
		<resultNode name="Matches" type="decision">
			<expected>
				<value>true</value>
			</expected>
		</resultNode>
		<resultNode name="Replace" type="decision">
			<expected>
				<component name="Aao">
					<value>bonono</value>
				</component>
				<component name="AanplusStarstar">
					<value>b**a</value>
				</component>
				<component name="encloseVowels">
					<value>b[a]n[a]n[a]</value>
				</component>
			</expected>
		</resultNode>
		<resultNode name="Constructor" type="decision">
			<expected>
				<value xsi:type="xsd:string">2</value>
			</expected>
		</resultNode>
	</testCase>
</testCases>
