<?xml version="1.0" encoding="UTF-8"?>
<testCases xmlns="http://www.omg.org/spec/DMN/20160719/testcase"
	xmlns:xsi="http://www.w3.org/2001/XMLSchema-instance"
	xsi:schemaLocation="http://www.omg.org/spec/DMN/20160719/testcase ../../TestCases/testCases.xsd">
	<modelName>lending1.dmn</modelName>
	<testCase id="001">
		<inputNode name="Applicant Data">
			<component name="Monthly">
				<component name="Income">
					<value>6000</value>
				</component>
				<component name="Expenses">
					<value>2000</value>
				</component>
				<component name="Repayments">
					<value>0</value>
				</component>
			</component>
			<component name="Age">
				<value>35</value>
			</component>
			<component name="Existing Customer">
				<value>true</value>
			</component>
			<component name="Marital Status">
				<value>M</value>
			</component>
			<component name="Employment Status">
				<value>EMPLOYED</value>
			</component>
		</inputNode>
		<inputNode name="Requested Product">
			<component name="Product Type">
				<value>STANDARD LOAN</value>
			</component>
			<component name="Amount">
				<value>350000</value>
			</component>
			<component name="Rate">
				<value>0.0395</value>
			</component>
			<component name="Term">
				<value>360</value>
			</component>
		</inputNode>
		<inputNode name="Bureau Data">
			<component name="Credit Score">
				<value>649</value>
			</component>
			<component name="Bankrupt">
				<value>false</value>
			</component>
		</inputNode>
		<resultNode name="Application Risk Score" type="decision">
			<computed>
				<value>90</value>
			</computed>
		</resultNode>
		<resultNode name="Pre-bureau Risk Category" type="decision">
			<computed>
				<value>HIGH</value>
			</computed>
		</resultNode>
		<resultNode name="Bureau Call Type" type="decision">
			<computed>
				<value>FULL</value>
			</computed>
		</resultNode>
		<resultNode name="Post-bureau Risk Category" type="decision">
			<computed>
				<value>LOW</value>
			</computed>
		</resultNode>
		<resultNode name="Required Monthly Installment" type="decision">
			<computed>
				<value>1680.880325608555</value>
			</computed>
		</resultNode>
		<resultNode name="Pre-bureau Affordability" type="decision">
			<computed>
				<value>true</value>
			</computed>
		</resultNode>
		<resultNode name="Eligibility" type="decision">
			<computed>
				<value>ELIGIBLE</value>
			</computed>
		</resultNode>
		<resultNode name="Strategy" type="decision">
			<computed>
				<value>BUREAU</value>
			</computed>
		</resultNode>
		<resultNode name="Post-bureau Affordability" type="decision">
			<computed>
				<value>true</value>
			</computed>
		</resultNode>
		<resultNode name="Routing" type="decision">
			<computed>
				<value>ACCEPT</value>
			</computed>
		</resultNode>
	</testCase>
</testCases>
