<?xml version="1.0" encoding="UTF-8"?>
<testCases xmlns="http://www.omg.org/spec/DMN/20160719/testcase" xmlns:xsi="http://www.w3.org/2001/XMLSchema-instance" xsi:schemaLocation="http://www.omg.org/spec/DMN/20160719/testcase ../testCases.xsd">
	<modelName>0010-concatenate.dmn</modelName>
	<testCase>
		<inputNode name="simpleList">
			<list>
				<item>
					<value>a</value>
				</item>
				<item>
					<value>b</value>
				</item>
				<item>
					<value>c</value>
				</item>
			</list>
		</inputNode>
		<inputNode name="nestedList">
			<list>
				<item>
					<list>
						<item>
							<value>w</value>
						</item>
						<item>
							<value>x</value>
						</item>
					</list>
				</item>
				<item>
					<value>y</value>
				</item>
				<item>
					<value>z</value>
				</item>
			</list>
		</inputNode>
		<resultNode name="literalSimpleList">
			<expected>
				<list>
					<item>
						<value>a</value>
					</item>
					<item>
						<value>b</value>
					</item>
					<item>
						<value>c</value>
					</item>
				</list>
			</expected>
		</resultNode>
		<resultNode name="literalNestedList">
			<expected>
				<list>
					<item>
						<list>
							<item>
								<value>w</value>
							</item>
							<item>
								<value>x</value>
							</item>
						</list>
					</item>
					<item>
						<value>y</value>
					</item>
					<item>
						<value>z</value>
					</item>
				</list>
			</expected>
		</resultNode>
		<resultNode name="concatenate1">
			<expected>
				<list>
					<item>
						<value>a</value>
					</item>
					<item>
						<value>b</value>
					</item>
					<item>
						<value>c</value>
					</item>
					<item>
						<value>a</value>
					</item>
					<item>
						<value>b</value>
					</item>
					<item>
						<value>c</value>
					</item>
				</list>
			</expected>
		</resultNode>
		<resultNode name="concatenate2">
			<expected>
				<list>
					<item>
						<value>a</value>
					</item>
					<item>
						<value>b</value>
					</item>
					<item>
						<value>c</value>
					</item>
					<item>
						<list>
							<item>
								<value>w</value>
							</item>
							<item>
								<value>x</value>
							</item>
						</list>
					</item>
					<item>
						<value>y</value>
					</item>
					<item>
						<value>z</value>
					</item>
				</list>
			</expected>
		</resultNode>
		<resultNode name="concatenate3">
			<expected>
				<list>
					<item>
						<value>a</value>
					</item>
					<item>
						<value>b</value>
					</item>
					<item>
						<value>c</value>
					</item>
					<item>
						<list>
							<item>
								<value>w</value>
							</item>
							<item>
								<value>x</value>
							</item>
						</list>
					</item>
					<item>
						<value>y</value>
					</item>
					<item>
						<value>z</value>
					</item>
				</list>
			</expected>
		</resultNode>
		<resultNode name="concatenate4">
			<expected>
				<list>
					<item>
						<value>a</value>
					</item>
					<item>
						<value>b</value>
					</item>
					<item>
						<value>c</value>
					</item>
					<item>
						<list>
							<item>
								<value>w</value>
							</item>
							<item>
								<value>x</value>
							</item>
						</list>
					</item>
					<item>
						<value>y</value>
					</item>
					<item>
						<value>z</value>
					</item>
				</list>
			</expected>
		</resultNode>
	</testCase>
</testCases>
