<?xml version="1.0" encoding="UTF-8"?>
<testCases xmlns="http://www.omg.org/spec/DMN/20160719/testcase" xmlns:xsi="http://www.w3.org/2001/XMLSchema-instance" xsi:schemaLocation="http://www.omg.org/spec/DMN/20160719/testcase ../testCases.xsd">
	<modelName>0004-lending.dmn</modelName>
	<testCase id="001">
		<inputNode name="ApplicantData" type="inputData">
			<component name="Monthly">
				<component name="Income">
					<value>6000</value>
				</component>
				<component name="Expenses">
					<value>2000</value>
				</component>
				<component name="Repayments">
					<value>0</value>
				</component>
			</component>
			<component name="Age">
				<value>35</value>
			</component>
			<component name="ExistingCustomer">
				<value>true</value>
			</component>
			<component name="MaritalStatus">
				<value>M</value>
			</component>
			<component name="EmploymentStatus">
				<value>EMPLOYED</value>
			</component>
		</inputNode>
		<inputNode name="RequestedProduct" type="inputData">
			<component name="ProductType">
				<value>STANDARD LOAN</value>
			</component>
			<component name="Amount">
				<value>350000</value>
			</component>
			<component name="Rate">
				<value>0.0395</value>
			</component>
			<component name="Term">
				<value>360</value>
			</component>
		</inputNode>
		<inputNode name="BureauData" type="inputData">
			<component name="CreditScore">
				<value>649</value>
			</component>
			<component name="Bankrupt">
				<value>false</value>
			</component>
		</inputNode>
		<inputNode name="SupportingDocuments" type="inputData">
			<value>YES</value>
		</inputNode>
		<inputNode name="Adjudication" type="decision">
			<value>ACCEPT</value>
		</inputNode>
		<resultNode name="ApplicationRiskScore" type="decision">
			<expected>
				<value>130</value>
			</expected>
		</resultNode>
		<resultNode name="Pre-bureauRiskCategory" type="decision">
			<expected>
				<value>LOW</value>
			</expected>
		</resultNode>
		<resultNode name="BureauCallType" type="decision">
			<expected>
				<value>MINI</value>
			</expected>
		</resultNode>
		<resultNode name="Post-bureauRiskCategory" type="decision">
			<expected>
				<value>LOW</value>
			</expected>
		</resultNode>
		<resultNode name="RequiredMonthlyInstallment" type="decision">
			<expected>
				<value>1680.880325608555</value>
			</expected>
		</resultNode>
		<resultNode name="Pre-bureauAffordability" type="decision">
			<expected>
				<value>true</value>
			</expected>
		</resultNode>
		<resultNode name="Eligibility" type="decision">
			<expected>
				<value>ELIGIBLE</value>
			</expected>
		</resultNode>
		<resultNode name="Strategy" type="decision">
			<expected>
				<value>BUREAU</value>
			</expected>
		</resultNode>
		<resultNode name="Post-bureauAffordability" type="decision">
			<expected>
				<value>true</value>
			</expected>
		</resultNode>
		<resultNode name="Routing" type="decision">
			<expected>
				<value>ACCEPT</value>
			</expected>
		</resultNode>
	</testCase>
</testCases>
